{
  "$schema": "https://json-schema.org/draft/2020-12/schema",
  "$id": "https://scrollcase.dev/schema/v3/box-manifest.schema.json",
  "title": "Box manifest (box.json)",
  "description": "The manifest packed inside the archive at box.json. It restates the box's identity, layout and provenance so an extracted box is self-describing: a consumer that has the directory but not the release document can still tell what it is holding and how it was built.",
  "type": "object",
  "additionalProperties": false,
  "required": [
    "schemaVersion",
    "boxId",
    "version",
    "target",
    "runtime",
    "cacheSubdir",
    "selfTest",
    "provenance"
  ],
  "properties": {
    "schemaVersion": {
      "const": 3
    },
    "boxId": {
      "type": "string",
      "minLength": 1
    },
    "labels": {
      "$ref": "https://scrollcase.dev/schema/v3/release-manifest.schema.json#/$defs/labels"
    },
    "version": {
      "type": "string",
      "minLength": 1
    },
    "target": {
      "$ref": "https://scrollcase.dev/schema/v3/target.schema.json"
    },
    "runtime": {
      "$ref": "https://scrollcase.dev/schema/v3/release-manifest.schema.json#/$defs/runtime"
    },
    "cacheSubdir": {
      "type": "string",
      "minLength": 1
    },
    "environment": {
      "type": "object",
      "description": "Environment variables repeated from the signed release. Scrollcase consumers compare this declaration before execution and apply it over inherited and caller-supplied values.",
      "propertyNames": {
        "minLength": 1,
        "pattern": "^[^=\\u0000]+$"
      },
      "additionalProperties": {
        "type": "string",
        "pattern": "^[^\\u0000]*$"
      }
    },
    "selfTest": {
      "$ref": "https://scrollcase.dev/schema/v3/release-manifest.schema.json#/$defs/selfTest"
    },
    "execution": {
      "$ref": "https://scrollcase.dev/schema/v3/execution.schema.json"
    },
    "provenance": {
      "$ref": "https://scrollcase.dev/schema/v3/release-manifest.schema.json#/$defs/provenance"
    },
    "assets": {
      "$ref": "https://scrollcase.dev/schema/v3/release-manifest.schema.json#/$defs/deferredAssets"
    }
  }
}
